{
  "protocol": "profinet",
  "device": {
    "name": "codesys_pn_dut",
    "role": "server"
  },
  "cycle_ms": 8,
  "protocol_params": {
    "_comment": "CODESYS PROFINET Controller (package required). Default iface=mock so this JSON does not need CAP_NET_RAW. Live SoftPLC needs a real NIC + GSDML import; set iface and security_class 0 (unsigned lab — CODESYS typically has no PN Sec Class 1 HMAC). Not PI certification. IRT/CC-C off.",
    "iface": "mock",
    "device_name": "sensor-line1",
    "vendor_id": 43981,
    "device_id": 1,
    "ip": "192.168.0.10",
    "netmask": "255.255.255.0",
    "gateway": "192.168.0.1",
    "security_class": 0,
    "input_len": 40,
    "output_len": 8,
    "cycle_us": 8000
  },
  "points": [
    {
      "name": "barcode_value",
      "access": "read",
      "data_type": "string",
      "length": 32,
      "address": {
        "profinet": {
          "slot": 1,
          "subslot": 1,
          "index": 1,
          "byte_offset": 0,
          "length": 32
        }
      }
    },
    {
      "name": "temperature",
      "access": "read",
      "data_type": "float",
      "length": 4,
      "address": {
        "profinet": {
          "slot": 1,
          "subslot": 1,
          "index": 1,
          "byte_offset": 32,
          "length": 4
        }
      }
    }
  ]
}
