{
  "protocol": "ethernetip",
  "device": {
    "name": "codesys_eip_dut",
    "role": "server"
  },
  "cycle_ms": 8,
  "protocol_params": {
    "_comment": "Live Adapter sockets for a CODESYS EtherNet/IP Scanner (package required). mock=false binds TCP/UDP — no CAP_NET_RAW. security_class 0 = unsigned lab; CODESYS Scanner typically has no CIP Security HMAC. Not ODVA certification.",
    "role": "server",
    "bind_ip": "0.0.0.0",
    "port": 44818,
    "udp_io_port": 2222,
    "vendor_id": 43981,
    "device_type": 12,
    "product_code": 1,
    "serial_number": 305419896,
    "product_name": "FieldbusSensor",
    "input_assembly": 150,
    "output_assembly": 101,
    "config_assembly": 100,
    "input_size": 64,
    "output_size": 16,
    "rpi_us": 8000,
    "security_class": 0,
    "protection_mode": 0,
    "lldp_enable": false,
    "acd_enable": false,
    "iface": "lo",
    "mock": false
  },
  "points": [
    {
      "name": "barcode_value",
      "access": "read",
      "data_type": "string",
      "length": 32,
      "address": {
        "ethernetip": {
          "tag": "Sensor1.Barcode",
          "assembly": 150,
          "byte_offset": 0,
          "length": 32
        }
      }
    },
    {
      "name": "temperature",
      "access": "read",
      "data_type": "float",
      "length": 4,
      "address": {
        "ethernetip": {
          "assembly": 150,
          "byte_offset": 32,
          "length": 4
        }
      }
    }
  ]
}
